year,governorate_1,governorate_2,planned,joint_statement,unspecified_JO,gov_collaboration,affiliates,parent_group,operations_room,big_bomb,target_class,target_class2,target_class3,target_class4,claim_source,notes,ose_claim_id,ose_date,frenemie_id,claim_full_text,Compound_Claim,Subject_Full_Name,subject,Object_Full_Name,object ,Posting_Full_Name,posting,type1,type2,type3,Pos_Existing_Ties,Neg_Existing_Ties,Duplicate,Frenemy_Notes,Interesting_Flag,Coder_ID,Skip
2012,Latakia,NA,no,no,no,no,no,SIF,no,no,SGF,.,.,.,direct_quote,Defection of approximately 30 soldiers in the village of Al-Ya'qubiyyah. The defection was secured by the Ahrar al-Sham Brigades,GMP20121225836001,2012-12-25,4,"""the syrian islamic front - the ahrar al-sham brigades -¬¨‚Ä†latakia and its countryside. urgent. defection of approximately 30 soldiers in the village of al-ya'qubiyyah. the defection was secured by the ahrar al-sham brigades.""",,soldiers,SGF,Ahrar al-sham Islamic Movement,ASIM,.,.,Defect_Pos,,,,,,,,ANS,.
2013,Aleppo,NA,no,yes,no,no,no,no,no,no,PKK,.,.,.,direct_quote,.,TRN2013071249820647,2013-07-12,6,"‚àö¬¢¬¨‚Ä†the al-tawhid brigade posted a message, claiming pkk had ""broken the truce"" and attacked checkpoints of the al-tawhid brigade and the islamic state in the levant, between dayr jamal town and kurdish abyan village. .",,al-Tawhid Brigade,ATB,Kurdistan Workers Party,PKK,al-Tawhid Brigade,ATB,Critique,,,,,,code on other side,,ANS,.
2013,Aleppo,NA,no,no,no,yes,no,ATB; FatahB,no,no,SGF,HIZ,.,.,parent_group,"""yes"" in frenemies because they are newly-merged (AS)",TRL2013092359568324,2013-09-23,7,"on 16 september, the al-tawhid brigade posted a‚àö¬¢¬¨‚Ä†youtube‚àö¬¢¬¨‚Ä†video, claiming the martyr umar isma'il battalion, an offshoot of the al-tawhid brigade's newly-merged group the al-fath brigade, sniped at syrian forces and hizballah members at the magharat al-artiq mountain on the shuwayhinah mountain in aleppo on 16 september.",,matyr umar isma'il battalion,MUIB,al-Fath brigade,FatahB,,,Merger,,,,,,,,ANS,.
2014,Deir ez-Zor,NA,no,no,no,no,no,no,no,no,ISIL,.,.,.,direct_quote,"ANF and ISIL ""breakup""?",TRN2014021544680166,2014-02-15,22,"on 9 february, twitter user ansar jabhat al-nusrah posted a tweet, in which the al-nusrah front claimed to have retained all headquarters, facilities, and laboratories belonging to the group from the islamic state of iraq and the levant in dayr al-zawr.",,Al-nusrah Front,ANF,ISIL,ISIL,Al-Nusrah Front,ANF,Weapon_Theft,,,,,,"ANF captures facilities of ISIL but they will later fight with/join ISIL. Would this count as a weapons_theft? Otherwise, not fremeies. Confused",yes,ANS,.
2014,Homs,NA,no,no,no,no,no,no,no,no,ANF,.,.,.,direct_quote,.,TRN2014071232137374,2014-07-12,32,"on 7 july, the isil claimed to have seized many weapons from a convoy of anti-isil forces, including al-nusrah front, in al-sharqiyah, homs. the attack took place on 4 july",,ISIL,ISIL,Al-Nusrah Front,ANF,ISIL,ISIL,Weapon_Theft,,,,Y,,weapons theft,,ANS,.
2014,Daraa,NA,no,yes,no,no,no,no,yes,no,.,.,.,.,direct_quote,jointstatement exception,TRN2014072528558950,2014-07-25,35,"on 20 july, the islamic front posted a message, announcing the formation of the operations room of ""fatah al-sham [conquering the levant]"" in dar'a governorate, in collaboration with ""other factions,"" and the launching of the two battles of ""al-mughirat subhan and the qat al-qatin [koranic verses].""",,.,.,Fatah al-Sham,FSOR,Islamic Front,IF,JOR,,,,,,IF launches operations room. The first one reported in this data. ,,ANS,.
2015,Rif Damashq,NA,no,no,no,no,no,no,no,no,.,.,.,.,direct_quote,A convoluted quazi pro-social statement in which AASG appears to acknolwedge the legitimacy of the Islamic judiciary but refuses to acknowledge their request to disarm.,TRR2015042970643802,2015-04-29,56,"/at 1804 gmt on 29 april, twitter user ""‚Äö√Ñ√¥muzamjir al-sham"" tweeted an embedded image of ajnad al-sham islamic union's official statement regarding an islamic court's decision ordering the ahrar al-sham islamic movement to surrender its weapons and facilities east of damascus. below is a translation of the statement./
 
 
 ""[logo bearing the words:] there is no god but god and muhammad is his messenger -- ajnad al-sham islamic union ""in the name of god, the merciful, the compassionate, ""'the believers are but a single brotherhood: so make peace and reconciliation between your two brothers; and fear allah, that ye may receive mercy,' [koranic verse, al-hujurat, 49:10]. ""we in the ajnad al-sham islamic union affirm that the islamic court has jurisdiction over disputes and we regard the preservation of its powers and independence as a religious necessity. we laud our brothers in the ahrar al-sham movement for their compliance, despite having reservations, with the court's decision ordering them to surrender their weapons and the sites under their control. the decision will have negative repercussions on the revolution and we appreciate their [ahrar al-sham's] right to appeal the decision within a timeline until a final decision in the case is made so that the war effort does not regress in eastern al ghutah area of damascus . ""the ajnad al-sham islamic union affirms that the ahrar al-sham movement in eastern al ghutah ranks among the original revolutionary factions and is one of the founders of eastern al ghutah's united military leadership. by no means should it be regarded as a newly formed faction in eastern al ghutah, despite having been marketed as such. we affirm that ahrar al-sham are our brothers. we began the war together and, god willing, we will triumph over al-asad's gang together. ""we in the ajnad al-sham islamic union have stood and continue to stand on common ground with other revolutionary factions. we will spare no effort and will go to any length to achieve unity. the ajnad al-sham islamic union ""in jihad...there is only victory or martyrdom ""7 rajab 1436 [corresponding to] 29 april 2015""",,Ajnad al-sham,AASG,Ahrar al-sham,ASIM,Ajnad al-sham,AASG,Gen_Pos,,,,,,"For an unstated reason AASG has been ordered by an islamic court to surrender it's weapons and facilites east of damascus. 
AASG complies with the request with this statemen although they state their reservation in this statement including that it is bad for the revolution, that AASG was one of the original revolutionary groups. confused",,ANS,.
2015,Aleppo,NA,yes,no,no,no,no,no,no,no,YPG,.,.,.,direct_quote,assuming YPK is a typo,TRN2015050246596878,2015-05-02,57,"at 1015 gmt on 2 may, twitter user ""muzamjir al-sham"" tweeted ""ahrar al-sham [islamic movement], al-nusrah front, al-sham corps, and [nur al-din] al-zanki [movement] commit to make the assaulting kurdish ypk militias pay for their actions in aleppo."" the tweet includes an embedded image of a statement to that effect, signed and bearing the official stamps of 15 factions. as of 0900 gmt on 4 may, the tweet had been retweeted 86 times, generating 94 favorites. below is a translation of the statement, which was mentioned in the previously released ""syria: isil, armed groups infighting update 2-4 ma//y"" / ""statement in support of the people of the shaykh maqsud neighborhood ""in response to the appeal for help by the people in the shaykh maqsud neighborhood of different kurdish and arab ethnicities, and to maintain their rights and dignity against repeated attacks by the ypk [alternative abbreviation for ypg, people's protection units, armed wing of the kurdish supreme committee] and asayish [kurdish intelligence services] forces, arab and kurdish dignitaries of aleppo convened and decided to take all the legitimate actions needed to help the oppressed people and to repel aggression either by peaceful means or by war. 'and soon will the unjust assailants know what vicissitudes their affairs will take! [partial koranic verse, al-shu'ara, 26:227]'"" the statement ends with signatures of representatives of the groups and their seals. they include abu-imarah battalions, ahrar al-sham islamic movement, al-safwah battalions, first regiment, al-nusrah front, ahrar syria, nur al-din zanki movement, kurdish front, 16th regiment, al-fajr movement [fajr al-sham islamic movement], the levantine front, al-sham corps, and other factions whose names are indistinct.",,"abu-imarah battalions; 
ahrar al-sham islamic movement;
al-safwah battalions;
first regiment;
al-nusrah front;
ahrar syria;
nur al-din zanki movement;
kurdish front;
16th regiment;
al-fajr movement;
the levantine front;
al-sham corps",,YPG,YPG,,,Critique,,,,,,A statement signed by over a dozen fractions condemns the actions of YPG against civilians and agrees to defend the civilians in shaykh maqsud.,,ANS,.
2015,Damascus,NA,no,no,no,no,no,no,no,no,.,.,.,.,news_general,.,TRR2015050477314128,2015-05-04,59,"on 2 may, the ""yarmouk camp news"" facebook page posted an update claiming that ""all mediation attempts failed"" between ""the da'ish and al-nusrah [front] gangs on one hand and militants of bayt saham, yalda, and babila [on the other]"" to end fighting ""south of #alyarmuk_camp and al-hajar al-aswad."" it notes that ""a few days ago"" an official from jaysh al-islam met with an al-nusrah front official named ""bilal khadr sulayman, aka abu-sulayman"" but they ""did not reach an agreement,"" which the update claims, is because ""the al-nusrah [front] gang demanded the return of its headquarters in bayt saham and babila to stop the fighting, but the militants from these towns refused."" the update concludes that there is ""renewed talked"" of a visit ""soon"" by a palestinian authority ""delegation"" to al yarmuk camp",,ISIL,ISIL,Al-Nusrah Front,ANF,,,Negotiations,,,,Y,,failed talks between ISIL and ANF. notable person: bilal khadr sulayman,,ANS,.
NA,Idlib,,,no,,no,,,NA,no,.,.,.,.,.,ANF is accused of theft but they were fold falsely that what they stole belonged to Hazm implying that they thought they were stealing it back for them,TRR2015050477314128,2015-05-04,60,"/screenshot from video of pro-regime palestinian fighters battling isil
 
 in al yarmuk camp. top-left: vanguard for the popular liberation war --
 
 al-sa'iqah forces logo./
 
 
 
 additionally, twitter user ""muzamjir al-sham"" tweeted
 
 an embedded image of a statement attributed to the 101 infantry division
 
 of free syrian army accusing al-nusrah front of attacking its
 
 ""headquarters"" and stealing its ""property"" in the village of harabnush.
 
 the statement indicates that defecting members of the division told
 
 al-nusrah front, falsely, that the division was an ""agent of the regime""
 
 and possessed weapons which previously belonged to hazm movement
 
 prompting al-nusrah front to ""send a [military] convoy"" which ""raided""
 
 the village and clashed with the division's fighters. it also accuses
 
 al-nusrah front of ""raiding the home"" of ibrahim dabbas. the statement
 
 then calls for al-nusrah front to return the division's property and
 
 asks that jaysh al-fath and ahrar al-sham islamic movement intervene
 
 between the two parties.",,Al-Nusrah Front,ANF,101st infantry,101st,101st infantry,101st,Weapon_Theft,,,,,,"This statement shows the roles of several groups. the 101st shares that FSA accuses ANF of attacking and stealing from them. It becomes clear later in the claim that they share this because the 101 also blames ANF for stealing from them. 
It also includes details that members of the 101 defected and went to ANF to say that the 101 are ""agents of the regime"" (the statement says this is false)
This is the first example of sewn susspicion between groups and is interesting because the actors and motivations are so clear. 
the 101 also calls on JAF and ASIM to intervene between the two parties. ",yes,ANS,.
NA,Idlib,,,no,,no,,,NA,no,.,.,.,.,.,ANF is accused of theft but they were fold falsely that what they stole belonged to Hazm implying that they thought they were stealing it back for them,TRR2015050477314128,2015-05-04,60.1,"/screenshot from video of pro-regime palestinian fighters battling isil
 
 in al yarmuk camp. top-left: vanguard for the popular liberation war --
 
 al-sa'iqah forces logo./
 
 
 
 additionally, twitter user ""muzamjir al-sham"" tweeted
 
 an embedded image of a statement attributed to the 101 infantry division
 
 of free syrian army accusing al-nusrah front of attacking its
 
 ""headquarters"" and stealing its ""property"" in the village of harabnush.
 
 the statement indicates that defecting members of the division told
 
 al-nusrah front, falsely, that the division was an ""agent of the regime""
 
 and possessed weapons which previously belonged to hazm movement
 
 prompting al-nusrah front to ""send a [military] convoy"" which ""raided""
 
 the village and clashed with the division's fighters. it also accuses
 
 al-nusrah front of ""raiding the home"" of ibrahim dabbas. the statement
 
 then calls for al-nusrah front to return the division's property and
 
 asks that jaysh al-fath and ahrar al-sham islamic movement intervene
 
 between the two parties.",,101st infantry,101st,Syrian Government,SGF,101st infantry Fighters,101st Fighters,Collaboration,,,,,,"This statement shows the roles of several groups. the 101st shares that FSA accuses ANF of attacking and stealing from them. It becomes clear later in the claim that they share this because the 101 also blames ANF for stealing from them. 
It also includes details that members of the 101 defected and went to ANF to say that the 101 are ""agents of the regime"" (the statement says this is false)
This is the first example of sewn susspicion between groups and is interesting because the actors and motivations are so clear. 
the 101 also calls on JAF and ASIM to intervene between the two parties. ",yes,ANS,.
NA,Idlib,,,no,,no,,,NA,no,.,.,.,.,.,ANF is accused of theft but they were fold falsely that what they stole belonged to Hazm implying that they thought they were stealing it back for them,TRR2015050477314128,2015-05-04,60.2,"/screenshot from video of pro-regime palestinian fighters battling isil
 
 in al yarmuk camp. top-left: vanguard for the popular liberation war --
 
 al-sa'iqah forces logo./
 
 
 
 additionally, twitter user ""muzamjir al-sham"" tweeted
 
 an embedded image of a statement attributed to the 101 infantry division
 
 of free syrian army accusing al-nusrah front of attacking its
 
 ""headquarters"" and stealing its ""property"" in the village of harabnush.
 
 the statement indicates that defecting members of the division told
 
 al-nusrah front, falsely, that the division was an ""agent of the regime""
 
 and possessed weapons which previously belonged to hazm movement
 
 prompting al-nusrah front to ""send a [military] convoy"" which ""raided""
 
 the village and clashed with the division's fighters. it also accuses
 
 al-nusrah front of ""raiding the home"" of ibrahim dabbas. the statement
 
 then calls for al-nusrah front to return the division's property and
 
 asks that jaysh al-fath and ahrar al-sham islamic movement intervene
 
 between the two parties.",,101st infantry Fighters,101st Fighters,101st infantry,101st,101st infantry,101st,Defect_Neg,,,,,,"This statement shows the roles of several groups. the 101st shares that FSA accuses ANF of attacking and stealing from them. It becomes clear later in the claim that they share this because the 101 also blames ANF for stealing from them. 
It also includes details that members of the 101 defected and went to ANF to say that the 101 are ""agents of the regime"" (the statement says this is false)
This is the first example of sewn susspicion between groups and is interesting because the actors and motivations are so clear. 
the 101 also calls on JAF and ASIM for mediantion help and intervention. ",yes,ANS,.
2015,Damascus,NA,no,no,no,no,no,no,no,no,CIV,.,.,.,other_militants,"promoted by ANF and JAF, ISIL allegedly paid children to attack ANF",TRL2015051276665173,2015-05-12,63,"/screenshot from video of two children captured by al-nusrah front
 
 
 who claim that isil paid them to attack al-nusrah front.
 
 
 top-left: al-nusrah front's ""al qalamun correspondent"" logo.
 
 
 top-right: jaysh al-fath in al qalamun logo./",,Al-Nusrah Front,ANF,Islamic State,ISIL,,,Critique,,,,,,ANF critiques ISIL,,ANS,.
NA,Damascus,,,no,,no,,,NA,no,.,.,.,.,direct_quote,JAF announces decision to eradicate ISIL,TRL2015051276665173,2015-05-12,64,"/image of statement by jaysh al-fath in al qalamun announcing its
 
 decision to ""eradicate"" isil/
 
 
 
 on 12 may, twitter user ""jaysh al-fath -- al qalamun"" 
 
 tweeted a link to a statement announcing the group's decision to
 
 ""eradicate"" isil from the area. the statement lists numerous reasons why
 
 the group has chosen to fight isil, including a number of attacks by
 
 isil against ""the mujahideen"" in al qalamun. isil is also accused of
 
 taking their weapons and facilities; killing a number of prominent
 
 commanders, including ""abu-usamah al-banyasi [former isil amir of al
 
 qalamun reported killed after refusing to fight al-nusrah front],"" due
 
 to his ""commitment to the truth;"" ""terrorizing muslims"" in aarsal; not
 
 complying with outside sharia bodies; and holding other muslims to be
 
 infidels. it then notes that ""in the past two months,"" isil began to
 
 ""cut off the mujahideen's supply lines"" and set up checkpoints, forcing
 
 ""the mujahideen"" to find alternate routes in the region. the statement
 
 concludes by asserting that jaysh al-fath was ""forced to fight"" isil to
 
 ""stop this charade."" osc plans to process this item separately as
 
 trr2015051214966556.",,Jaysh al-Fath,JAF,Islamic State,ISIL,Jaysh al-Fath,JAF,Critique,,,,,,JAF announces it's intentions to fight ISIL. Is fighting ISIL what causes the resistance to breakdown?,,ANS,.
NA,.,,,no,,no,,,NA,no,.,.,.,.,other,"JAF vows to fight ISIL, fighting spilling over into Lebanon",TRR2015051380581062,2015-05-13,66,"on 11 may, jaysh al-fath in al qalamun announced its ""decision"" to fight
 
 isil, leading to a flareup of infighting in the region between isil and
 
 al-nusrah front, which reaffirmed its commitment today by vowing to
 
 ""continue"" its fight against isil. in addition to ongoing fighting in
 
 syria, numerous reports indicate that the fighting between the two
 
 groups has spilled over into lebanon, in the outskirts of aarsal.",,Jaysh al-Fath,JAF,ISIL,ISIL,,,Critique,,,,,,"the announcement by JAF incites fighting between ANF and ISIL
Coding announcement of decision to fight as critique. ",,ANS,.
NA,.,,,no,,no,,,NA,no,.,.,.,.,other,"JAF now affirms that their priorities are not ISIL but HIZ and SGF, a direct conflict with claims made earlier the same day. Group: Wa Itasimu Bi Hablin Allah Grouping not included in the name disambiguation",TRR2015051380581062,2015-05-13,67,"on 13 may, twitter user ""wa itasimu bi hablin allah"" , the
 
 official account of the wa itasimu bi hablin allah grouping, tweeted a
 
 link to a statement by the group, which is a part of jaysh al-fath in al
 
 qalamun, claiming that jaysh al-fath ""was not formed to fight the
 
 islamic state and this was not agreed upon in its charter."" the group
 
 announces that it is ""distancing itself from this discord,"" declaring
 
 that ""our fight"" is against hizballah and the syrian regime, not isil.
 
 the statement notes that the grouping is comprised of the following
 
 factions: al-ghuraba brigade, damascus eagles brigade, al-sayf al-umari
 
 battalions, and the men of al qalamun brigades.",,wa itasimu bi hablin allah grouping,WIBH,Jaysh al-Fath,JAF,wa itasimu bi hablin allah grouping,WIBH,Critique,,,,,,"groups condemn JAF for fighting ISIL because it is not in their charter. Sounds identitical to state diplomacy/security. 
It should be noted that these are all smaller groups, JAF is, I'm assuming, much larger",,ANS,.
NA,.,,,no,,no,,,NA,no,.,.,.,.,other,"JAF now affirms that their priorities are not ISIL but HIZ and SGF, a direct conflict with claims made earlier the same day. Group: Wa Itasimu Bi Hablin Allah Grouping not included in the name disambiguation",TRR2015051380581062,2015-05-13,67.1,"on 13 may, twitter user ""wa itasimu bi hablin allah"" , the
 
 official account of the wa itasimu bi hablin allah grouping, tweeted a
 
 link to a statement by the group, which is a part of jaysh al-fath in al
 
 qalamun, claiming that jaysh al-fath ""was not formed to fight the
 
 islamic state and this was not agreed upon in its charter."" the group
 
 announces that it is ""distancing itself from this discord,"" declaring
 
 that ""our fight"" is against hizballah and the syrian regime, not isil.
 
 the statement notes that the grouping is comprised of the following
 
 factions: al-ghuraba brigade, damascus eagles brigade, al-sayf al-umari
 
 battalions, and the men of al qalamun brigades.",,"Saraya al-ghurabaa;
Damascus Eagles Brigade;
al-sayf al-umari battalions;
Maghawir al-Qalamun Brigade",SalGH; Eagles; Umari; MWRAQB,Jaysh al-Fath,JAF,wa itasimu bi hablin allah grouping,WIBH,Critique,,,,,,"groups condemn JAF for fighting ISIL because it is not in their charter. Sounds identitical to state diplomacy/security. 
It should be noted that these are all smaller groups, JAF is, I'm assuming, much larger
There were multiple ""al-qalamun brigades"" ",,ANS,.
NA,Damascus,Rif Dimashq,,no,,no,,,NA,no,.,.,.,.,.,.,TRN2015051333821588,2015-05-13,68,"/the official twitter account of the ""islamic front"" posted a number of messages and youtube videos,
 
 claiming responsibility for the following attacks , as part of jaysh al-fatah operations room):/
 
 
 
  * posting a video statement by jaysh al-muslimin, operating in
 
  damascus and rif dimashq, announcing joining asim -- .",,jaysh al-muslimin,JaMus,Ahrar al-Sham Islamic Movement,ASIM,Islamic Front,IF,Merger,,,,,,groups join ASIM,,ANS,.
NA,Damascus,,,no,,no,,,NA,no,.,.,.,.,other_militants,Duha al-Islam ammounces joining ASIM and all other comonents affiliated with ASIM,TRN2015051333821588,2015-05-13,69,"/the official twitter account of the ""islamic front"" posted a number of messages and youtube videos,
 
 claiming responsibility for the following attacks , as part of jaysh al-fatah operations room):/
 
 
 
  * posting a video statement by duha al-islam brigade, operating in
 
  southern damascus, announcing joining asim and affiliating itself,
 
  ""with all its components,"" under its command -- .",,Duha al-islam,DuAI,Ahrar al-Sham Islamic Movement,ASIM,Islamic Front,IF,Merger,,,,,,groups join ASIM,,ANS,.
NA,Damascus,,,no,,no,,,NA,no,.,.,.,.,.,Sa'd Bin-Amir Brigade announce joining ASIM,TRN2015051333821588,2015-05-13,70,"/the official twitter account of the ""islamic front"" posted a number of messages and youtube videos,
 
 claiming responsibility for the following attacks , as part of jaysh al-fatah operations room):/
 
 
 
  posting a video statement by sa'id bin-amir brigade, operating in
 
  qabun neighborhood in damascus, announcing joining asim --
 
  .",,sa'id bin-amir,SBAB,Ahrar al-Sham Islamic Movement,ASIM,Islamic Front,IF,Merger,,,,,,Earliest mention of JAFOR: IF is part of JAFOR,,ANS,.
2015,NA,NA,no,yes,no,no,yes,ACOR,yes,no,.,.,.,.,direct_quote,adding more to affiliates,LIN2015051574166894,2015-05-15,71,"the ""official"" twitter account of the fatah halab operations room on 14 may 2015 posted ""statement no. 3"" announcing that ""other factions had joined the fatah halab operations room,"" and that ""the number of factions affiliated with it has increased to 31."" following are the names of the factions affiliated with the fatah halab operations room: 1. al-jabhah al-shamiyah 2. ahrar al-sham 3. jaysh al-islam 4. faylaq al-sham 5. thuwwar al-sham battalions 6. fastaqim kama umirt gathering 7. fajr al-khilafah battalions 8. nur-al-din al-zinki movement 9. al-mujahideen army 10. jaysh al-sunnah 11. abu-amarah battalions 12. the 101st division 13. the 16th division 14. the 13th division 15. al-fatah brigade 16. al-sultan murad brigade 17. fursan al-haqq brigade 18. suqur al-ghab brigade 19. al-haqq brigade 20. al-furqan brigades 21. bayariq al-islam movement 22. al-hurriyah brigade 23. bayan movement 24. al-atarib martyrs brigade 25. al-sultan muhammad al-fatih brigade 26. al-asalah wa al-tanmiyah front 27. al-izzah gathering 28. ansar al-khilafah brigade 29. suqur al-jabal brigade 30. sayfallah brigade 31. al-nukhbah forces",,"al-jabhah al-shamiyah;
ahrar al-sham;
jaysh al-islam; 
faylaq al-sham; 
thuwwar al-sham battalions; 
fastaqim kama umirt gathering; 
fajr al-khilafah battalions;
nur-al-din al-zinki movement; 
al-mujahideen army; 
jaysh al-sunnah; 
abu-amarah battalions; 
101st division; 
16th division; 
13th division; 
al-fatah brigade; 
al-sultan murad brigade; 
fursan al-haqq brigade; 
suqur al-ghab brigade; 
al-haqq brigade; 
al-furqan brigades; 
bayariq al-islam movement; 
al-hurriyah brigade; 
bayan movement; 
al-atarib martyrs brigade; 
al-sultan muhammad al-fatih brigade; 
al-asalah wa al-tanmiyah front; 
al-izzah gathering; 
ansar al-khilafah brigade; 
suqur al-jabal brigade; 
sayfallah brigade; 
 al-nukhbah forces;","LF; 
ASIM; 
JAI; 
FayAS;
ThASB; 
FKUG;
NADAZM;
AMB; 
JS; 
Amarah;
101; 
16;
13th;
AfatB;
Sulta;
FAHB; 
SAGG; 
AH; 
AFB; 
BayAIM;
SAHurB; 
BayM; 
AtaMartyr; 
ASIMF; 
AsalahWa; 
ASIBB; 
AAK; 
SalJB; 
Sayfallah; 
ANA


  


",Fatah Halab Operations Room,FHOR,,,JOR,,,,,,Roll call of all the factions in the Fatah Halab Operations Room,yes,ANS,.
