year,governorate_1,governorate_2,planned,joint_statement,unspecified_JO,gov_collaboration,affiliates,parent_group,operations_room,big_bomb,target_class,target_class2,target_class3,target_class4,claim_source,notes,ose_claim_id,ose_date,frenemie_id,claim_full_text,Compound_Claim,Subject_Full_Name,subject,Object_Full_Name,object ,Posting_Full_Name,posting,type1,type2,type3,Pos_Existing_Ties,Neg_Existing_Ties,Duplicate,Frenemy_Notes,Interesting_Flag,Coder_ID,Skip
2015,Aleppo,NA,no,no,no,no,no,no,no,no,.,.,.,.,news_general,SKIP: refuting rumors... frenemies...YPG denying connection to particular conflicts,LIR2015120754493507,2015-12-07,352,"-- on 27 november, welati -- independent, moderately anti-regime news
 
 
 network -- and other websites carried a statement by ahrar syria brigade
 
 
 in which the latter declared the shaykh maqsud neighborhood in the city
 
 
 of aleppo a military zone, giving civilians 24 hours to leave the
 
 
 quarter to avoid coming under shelling. the statement said: ""this
 
 
 follows acts of treason by the [kurdistan workers' party] pkk [in
 
 
 reference to the democratic union party, pyd] and the revolutionaries'
 
 
 army in afrin and their coordination with the russian occupation to
 
 
 carry out several air raids on revolutionaries' areas and to provide an
 
 
 air cover for the party's [pyd] militants as they infiltrated al-faysal
 
 
 flour mill and villages including kasht'ar and al malikiyah to seize the
 
 
 aleppo-i'zaz road."" meanwhile, in a statement, the ypg distanced itself
 
 
 from events in the i'zaz countryside, saying: ""once again, we at the ypg
 
 
 announce that we have nothing to do with the ongoing conflict in the
 
 
 i'zaz countryside between the revolutionaries' army and other factions.""","ahrar syria brigade in which the latter declared the shaykh maqsud neighborhood in the city of aleppo a military zone, giving civilians 24 hours to leave the quarter to avoid coming under shelling. the statement said: ""this follows acts of treason by the [kurdistan workers' party] pkk [in reference to the democratic union party, pyd] and the revolutionaries' army in afrin and their coordination with the russian occupation to carry out several air raids on revolutionaries' areas and to provide an air cover for the party's [pyd] militants as they infiltrated al-faysal flour mill and villages including kasht'ar and al malikiyah to seize the aleppo-i'zaz road.",ahrar syria brigade,ASyrB,Revolutionaries Army; Partiya Yekîtiya Demokrat,"RevA, PYD",,,Critique,,,,,,,,WJ,.
,,,,,,,,,,,,,,,,,,2015-12-07,352.1,"-- on 27 november, welati -- independent, moderately anti-regime news
 
 
 network -- and other websites carried a statement by ahrar syria brigade
 
 
 in which the latter declared the shaykh maqsud neighborhood in the city
 
 
 of aleppo a military zone, giving civilians 24 hours to leave the
 
 
 quarter to avoid coming under shelling. the statement said: ""this
 
 
 follows acts of treason by the [kurdistan workers' party] pkk [in
 
 
 reference to the democratic union party, pyd] and the revolutionaries'
 
 
 army in afrin and their coordination with the russian occupation to
 
 
 carry out several air raids on revolutionaries' areas and to provide an
 
 
 air cover for the party's [pyd] militants as they infiltrated al-faysal
 
 
 flour mill and villages including kasht'ar and al malikiyah to seize the
 
 
 aleppo-i'zaz road."" meanwhile, in a statement, the ypg distanced itself
 
 
 from events in the i'zaz countryside, saying: ""once again, we at the ypg
 
 
 announce that we have nothing to do with the ongoing conflict in the
 
 
 i'zaz countryside between the revolutionaries' army and other factions.""","the ypg distanced itself from events in the i'zaz countryside, saying: ""once again, we at the ypg announce that we have nothing to do with the ongoing conflict in the i'zaz countryside between the revolutionaries' army and other factions",People’s Protection Units,YPG,Revolutionaries Army,RevA ,,,Critique,,,,,,,,WJ,.
2015,NA,NA,no,no,no,no,no,no,yes,no,.,.,.,.,direct_quote,SKIP: frenemies Mari Operations Room (YPG accuses of affiliation with ANF),LIR2015120754493507,2015-12-07,353,"-- on 28 november, in a statement, the mari operations room of the free
 
 
 syrian army 
 
 
 held the ypg and the revolutionaries' army responsible for the
 
 
 ""massacre"" committed against a number of civilians in the village of
 
 
 tanb north of i'zaz.",,Mari Operations Room,MOR,People’s Protection Units; Revolutionaries Army,YPG; RevA,Mari Operations Room,MOR,Critique,,,,,,,,WJ,.
2015,NA,NA,no,no,no,no,no,no,no,no,.,.,.,.,indirect_quote,SKIP: frenemies/ ypg politics,LIL2015121349225958,2015-12-13,358,"-- on 8 december, hawar news agency -- pro-democratic union party 
 
 
 -- quoted furat khalil, a spokesperson for the people's protection units
 
 
  in ""afrin canton,"" saying that the syrian opposition conference in
 
 
 riyadh sought to ""exonerate"" militants from
 
 
 al-nusrah front and ahrar al-sham movement, ""to ensure they are not
 
 
 listed as terrorist organizations."" khalil added: ""those taking part in
 
 
 the riyadh conference are the same people who created the syrian crisis
 
 
 by sending regressive salafi forces to syria."" khalil went on to say
 
 
 that the syrian democratic forces were likely to be the
 
 
 ""alternative to the syrian regime and to the system sought by da'ish
 
 
 [arabic acronym for isil] and al-nusrah front mercenaries. the sdf made
 
 
 advances and gains in al jazirah canton and will triumph in afrin canton.""","khalil went on to say that the syrian democratic forces were likely to be the ""alternative to the syrian regime and",People’s Protection Units,YPG,Syrian Democratic Front,SDF,,,Gen_Pos,,,,,,,,WJ,.
,,,,,,,,,,,,,,,,,,2015-12-13,358.1,"-- on 8 december, hawar news agency -- pro-democratic union party 
 
 
 -- quoted furat khalil, a spokesperson for the people's protection units
 
 
  in ""afrin canton,"" saying that the syrian opposition conference in
 
 
 riyadh sought to ""exonerate"" militants from
 
 
 al-nusrah front and ahrar al-sham movement, ""to ensure they are not
 
 
 listed as terrorist organizations."" khalil added: ""those taking part in
 
 
 the riyadh conference are the same people who created the syrian crisis
 
 
 by sending regressive salafi forces to syria."" khalil went on to say
 
 
 that the syrian democratic forces were likely to be the
 
 
 ""alternative to the syrian regime and to the system sought by da'ish
 
 
 [arabic acronym for isil] and al-nusrah front mercenaries. the sdf made
 
 
 advances and gains in al jazirah canton and will triumph in afrin canton.""",to the system sought by da'ish [arabic acronym for isil] and al-nusrah front mercenaries.,People’s Protection Units,YPG,Al-Nusrah Front; Ahrar al-Sham Islamic Movement; Islamic State,ANF; ASIM; ISIL,,,Critique,,,,,,,,WJ,.
2015,Raqqa,NA,no,no,no,no,no,no,no,no,ARRB,.,.,.,news_general,accusations that YPG prohibiting arabs to return home in an aquisition for Kuridish claims,TRL2015121502538770,2015-12-15,363,"on 14 december, the ""raqqa is being slaughtered silently"" website
 
 
 claimed that ypg forces had ""cut off the last roads between ar raqqah
 
 
 and its northern countryside,"" noting that the ypg had not allowed ar
 
 
 raqqah revolutionaries brigade to keep a checkpoint open on one of the
 
 
 last remaining roads leading from ar raqqah city to the northern
 
 
 countryside. the website quotes a resident of the area accusing the ypg
 
 
 of seeking to change the demographics of the region by not allowing arab
 
 
 families to return to their villages.",,Ar Raqqah Revolutionaries Brigade,ARRB,People’s Protection Units,YPG,,,Critique,,,,,,important note on the ethnic/demographic component in this claim,,WJ,.
2016,Raqqa,NA,no,no,no,no,no,no,no,no,ARRB,.,.,.,direct_quote,"statement between arab residents directed at YPG; addressing arab displacement, violence etc.",TRL2015121579627196,2015-12-15,364,"on 15 december, twitter user ""ar raqqah tudhbah bi samt"" 
 
 
 tweeted an image of a statement attributed to ""the sons of ar raqqah
 
 
 tribes"" regarding a dispute between the ypg and the towns of tall abyad
 
 
 and suluk. the statement sets the following terms:
 
 
 
 
 
 ""1. members of the ypg will not be allowed to enter to the arab areas
 
 
 where our fighters are present.""
 
 
 
 
 
 ""2. the criminals who assaulted us must be rendered to an independent
 
 
 court within 48 hours.""
 
 
 
 
 
 ""3. the displacement [of arabs] under the pretext of [cooperation] with
 
 
 da'ish [arabic acronym for isil] is in fact a systematic practice
 
 
 against scores of arab villages in tall abyad and suluk.""
 
 
 
 
 
 ""4. we demand the initiation of an international investigation into the
 
 
 killings and assaults against the populace of the area.""
 
 
 
 
 
 ""5. we appeal to the united nations, amnesty international, and human
 
 
 rights organizations to assume their responsibilities toward the
 
 
 situation in the area of tall abyad.""
 
 
 
 
 
 the statement also claims that ""non-syrian kurds of foreign
 
 
 nationalities -- iraqi, iranian, turkish -- are the ones who are ruling
 
 
 the area of tall abyad,"" and stresses that ""we will not stand by while
 
 
 our people in suluk and tall abyad are subjected to systematic
 
 
 displacement and demand that the people's protection units let the area
 
 
 of tall abyad be governed by its people.""
 
 
 the statement also claims that ""non-syrian kurds of foreign
 
 
 nationalities -- iraqi, iranian, turkish -- are the ones who are ruling
 
 
 the area of tall abyad,"" and stresses that ""we will not stand by while
 
 
 our people in suluk and tall abyad are subjected to systematic
 
 
 displacement and demand that the people's protection units let the area
 
 
 of tall abyad be governed by its people.""
 
 
 /members of the ar raqqah tribes grouping urge the ypg to leave tall
 
 
 abyad./",,Raqqa FIGHTERS,ARRB,People’s Protection Units,YPG,Ar Raqqah Revolutionaries Brigade,ARRB,Critique,,,,,,"are the sons of ar raqqah tribes ARRB?intersting clash between Kurdish/Arab, accusations of ethnic separation systematically",,WJ,.
2016,Raqqa,NA,no,no,no,no,no,no,no,no,YPG,.,.,.,direct_quote,not sure if ARRB and YPG ever cooperate but this is an example of them not,TRL2015121579627196,2015-12-15,365,"on 15 december, the official facebook page of the ar raqqah
 
 
 revolutionaries brigade posted a video featuring members of the ""ar
 
 
 raqqah tribes grouping,"" including one individual who reads a written
 
 
 statement announcing that they will not allow ypg forces into arab areas
 
 
 under the control of the group's fighters and urging the ypg to leave
 
 
 tall abyad.",,Raqqa FIGHTERS,ARRB,People’s Protection Units,YPG,Ar Raqqah Revolutionaries Brigade,ARRB,Critique,,,,,,,,WJ,.
2015,NA,NA,no,yes,no,no,no,no,yes,no,no,.,.,.,direct_quote,.,TRL2015121579627196,2015-12-15,366,"on 15 december, the official facebook page of the local coordination
 
 
 committees posted an embedded image of a hand-written statement
 
 
 detailing an agreement between al-rahman legion, jaysh al-islam, the
 
 
 islamic union, al-nusrah front, and the ahrar al-sham islamic movement
 
 
 in eastern al ghutah to ""form an operations room to lead the battle in
 
 
 al murj sector."" the statement stipulates that ""each faction will
 
 
 appoint a representative and a deputy representative to the room,"" and
 
 
 lists their names. the statement further relates that ""jaysh al-islam,
 
 
 al-rahman legion, and al-nusrah front, pledged to commit 100 fighters,""
 
 
 while both the islamic union and ahrar al-sham pledged to commit 50
 
 
 fighters. according to the statement, ""it was agreed to appoint
 
 
 abu-bassam al-bara' [of al-rahman legion] as commander of the room and
 
 
 abu-khalid islam [of the islamic union] as his deputy.""",,Al-Rahman Corps,ARC,jaysh al-islam; islamic union; al-nusrah front; ahrar al-sham islamic movement,JAI; IU; ANF; ASIM,,,JOR,,,,,,,,WJ,.
2015,Rif Damashq,NA,no,no,no,no,no,no,yes,no,.,.,.,.,news_general,"formation of an operations room, name not given. Possibly al-marj operations room",LIR2015121649502252,2015-12-16,368,"orient tv reported that al-nusrah front, jaysh al-islam, faylaq al-rahman, the ajnad al-sham islamic union, and the ahrar al-sham movement formed a joint operations room in al marj.",,Al-Nusrah Front,ANF,"jaysh al-islam, Al-Rahman Corps; ajnad al-sham grouping; ahrar al-sham islamic movement",JAI; ARC; AASG; ASIM,,,JOR,,,,,,likely operations room from 366?,,WJ,.
2015,NA,NA,no,no,no,no,no,no,no,no,.,.,.,.,direct_quote,marked no in joint statement because groups are not on the ground,TRO2015121771997961,2015-12-17,371,"/at 1724 gmt on 16 december, twitter user ""al-fawj al-awal""
 
 
  tweeted:
 
 
  ""#statement | joint statement from the revolutionary factions supporting
 
 
  the riyadh conference,"" along with an embedded image of an
 
 
  arabic-language statement praising saudi efforts in support of the
 
 
  ""syrian revolution"" and the ""riyadh conference."" at 1639 gmt on the same
 
 
  day, twitter user ""tajamu'a fastaqim kama umirt"" tweeted the same statement bearing only the
 
 
  logo of fastaqim kama umirt grouping. below is a translation of the
 
 
  joint statement./
 
 
  
 
 
 
 
 
  ""fastaqim kama umirt grouping | the levantine front | the first regiment
 
 
  | thuwwar al-sham battalions [logos, from left to right]
 
 
  
 
 
 
 
 
  ""statement
 
 
  
 
 
 
 
 
  ""we in the signed factions:
 
 
  
 
 
 
 
 
  ""we thank the leadership and the people of the kingdom of saudia arabia
 
 
  for standing throughout the years by the side of the syrian people and
 
 
  their right to obtain their freedom.
 
 
  
 
 
 
 
 
  ""we also bless the tremendous efforts put forth -- and still being put
 
 
  forth -- by the kingdom to unify the ranks of the political and military
 
 
  actions of the syrian revolution, the crown of which is its embracing of
 
 
  the riyadh conference.
 
 
  
 
 
 
 
 
  ""we affirm our eagerness to speak as one and unite the ranks in this
 
 
  difficult stage that our revolution is passing through.
 
 
  
 
 
 
 
 
  ""we pledge to our proud people that we will not lay down our arms, which
 
 
  we have raised for them, until the goals of the revolution, for freedom,
 
 
  justice, and dignity, have been realized.
 
 
  
 
 
 
 
 
  ""'and allah hath full power and control over his affairs; but most among
 
 
  mankind know it not,' [partial koranic verse, yusuf 12:21].
 
 
  
 
 
 
 
 
  ""date: 16 december 2015""",,Fistaqim Kama Umirat,FKUG,levantine front;1st Brigade; Thuwwar al-Sham Brigade,LF; 1st; ThASB,,,Negotiations,Gen_Pos,,,,,factions in statement thanks Saudi Arabia for Support/ not sure how to code a jointly made statement,,WJ,.
2015,NA,NA,no,no,no,no,no,no,yes,no,.,.,.,.,news_general,SKIP: frenemies...ceasefire agreement,TRR2015122214325622,2015-12-22,372,"on 19 december, the ""khaled iskef"" facebook page posted an embedded
 
 
 image of a cease-fire agreement signed by the ypg and the conquest of
 
 
 aleppo operations room. the agreement includes the following terms:
 
 
 
 
 
  ""a reciprocal cease-fire shall be in effect between the two sides.""
 
 
 
 
 
  * ""civilians shall be able to move back and forth between ash shaykh
 
 
  maqsud [neighborhood in the city of aleppo] and [the town of]
 
 
  'afrin, through the areas and checkpoints that are under the control
 
 
  of the conquest of aleppo operations room, while pre-coordination is
 
 
  required for the combatants.""
 
 
 
 
 
  *""the crossing leading from ash shaykh maqsud to the regime-held
 
 
  areas shall be closed and a joint committee of the two sides shall
 
 
  monitor the closure.""
 
 
 
 
 
  * ""the crossings leading to 'afrin shall be opened.""
 
 
 
 
 
  * ""the factions affiliated with the conquest of aleppo operations room
 
 
  shall enter into ash shaykh maqsud in coordination with jaysh
 
 
  al-thuwwar and the ypg.""
 
 
 
 
 
  * ""the checkpoint of ash shaykh maqsud in al sikkah shall be manned
 
 
  jointly by the parties.""
 
 
 
 
 
  *""a military committee shall be formed by both parties to implement
 
 
  the agreed-upon terms and to decide on accepting or rejecting the
 
 
  locations of bunkers.""",,People’s Protection Units,YPG,Aleppo Conquest Operations Room,ACOR,,,Ceasefire,,,,,,,,WJ,.
NA,.,,,no,,no,,,NA,no,.,.,.,.,.,calls for the dissolution of JAF,TRR2015122884340560,2015-12-28,378,"on 26 december, the facebook page of ""husam tarshah,"" a member of the
 
 ahrar al-sham islamic movement's political office, posted a delayed
 
 response to al-nusrah front leader abu-muhammad al-jawlani's 12 december
 
 interview aired on orient tv 
 
 in which he denounced the syrian opposition conference in riyadh. in
 
 this comment, tarshah criticized al-jawlani for ""indulging in describing
 
 the flaws of the [riyadh] conference but refraining from giving any
 
 remedy."" he also criticized al-jawlani on the following issues:
 
  ""al-jawlani evaded the fact that the military solution is incapable
 
  of deciding the fate of the conflict, a fact that even shaykh
 
  'abdallah al-muhaysini [saudi jihadist cleric in syria] had come to
 
  terms with when he called for dissolving the jaysh al-fath
 
  [coalition]."" see also ose product trr2015122276646905.",,Ahrar al-Sham Islamic Movement,ASIM,Al-Nusrah Front,ANF,Ahrar al-Sham Islamic Movement,ASIM,Critique,,,,,,,,WJ,.
2015,NA,NA,no,no,no,no,no,FSA,no,no,.,.,.,.,direct_quote,.,TRR2016010102938353,2016-01-01,383,"on 30 december, twitter user ""dayr az zawr24"" tweeted a link to a statement by the lions of the east army, a free syrian army group, announcing ""the termination of the group's affiliation with the authenticity and development front."" the group also declares that ""it will not be affiliated with any other group, and we will announce our political office which will represent us abroad."" the group then urges ""all of the sons of the eastern region to join our ranks to aid us in the liberation of the eastern region from the evils of the nusayri [derogatory term for alawite] regime and da'ish [arabic acronym for isil].""",,Lions of East Army,LEA,Authenticity and Development Front,AADF,Lions of East Army,LEA,Breakup,,,y,,,,,WJ,.
2015,NA,NA,no,no,no,no,no,no,yes,no,.,.,.,.,direct_quote,SKIP: frenemies,TRR2016010102938353,2016-01-01,384,"on 31 december, twitter user ""jaysh al-thuwwar"" , the
 
 
 official account of a group by the same name, tweeted a link to a video
 
 
 featuring an interview with ""abu-'ali burdm, commander of jaysh
 
 
 al-thuwwar,"" in which he details his group's components, affiliations,
 
 
 and rivalries. below are selected answers from the interview:
 
 
 ""the syrian democratic forces is composed of the following groups:
 
 
  jaysh al-thuwwar, the kurdish people's protection units [ypg], the
 
 
  [kurdish] women protection units, the syriac military council,
 
 
  al-tahrir brigade, [and] al-sanadid forces, in addition to ar raqqah
 
 
  revolutionaries brigade, which was within the grouping, with a
 
 
  fighting force of 50,000 fighters. the kurds make up only 15 percent
 
 
  of the total.""",,Syrian Democratic Front,SDF,Al-Thuwar Battalions; people's protection units; Women’s Protection Units; Syriac Military Council; al-Tahrir Battalion; Sanadid Forces; Ar Raqqah Revolutiona,"AlThuB; YPG; YPJ; SMC; TahBatta; SanaF; ARRB
",Al-Thuwar Battalions,AlThuB,Formal_Alliance,,,,,,,,WJ,.
2018,NA,NA,no,no,no,no,no,no,no,no,.,NA,NA,NA,direct_quote,denying affiliation with ISIL,TRR2016010480888590,2016-01-04,386,"n 1 january, the official al-yarmuk martyrs brigade facebook page shared an image of a statement by al-yarmuk martyrs brigade in which the group declares that it is an ""independent"" organization and denies any affiliation with isil. the statement also urges the media to provide any evidence to the contrary directly to the the group's media office.",,Al-Yarmuk Brigade,AYAR,,,Al-Yarmuk Brigade,AYAR,Denial,,,,,,"""independent"" of ISIL = frenemies/ - code as denial w/o object",,WJ,.
,,,,,,,,,,,,,,,,,,2016-01-06,387,"on 6 january, youtube user ""al-qalamun news"" posted a video featuring a joint statement by jaysh al-islam and the martyr ahmad al-'abdu forces announcing ""safety for fighters of [jaysh] tahrir al-sham in the city of ad dumayr"" -- whom the former accuses of being affiliated with isil -- if they leave the group.","jaysh al-islam and the martyr ahmad al-'abdu forces announcing ""safety for fighters of [jaysh] tahrir al-sham in the city of ad dumayr""",Jaysh al-Islam; martyr ahmad al-abdo forces,JAI; MAAAF,Tahrir al-Sham Corps FIGHTERS,HTS FIGHTERS,,,Gen_Pos,,,,,,,,WJ,.
2016,Rif Damashq,NA,no,yes,no,no,no,no,no,no,.,.,.,.,direct_quote,groups say HTS will be safe if they leave the group,TRR2016010681588719,2016-01-06,387.1,"on 6 january, youtube user ""al-qalamun news"" posted a video featuring a joint statement by jaysh al-islam and the martyr ahmad al-'abdu forces announcing ""safety for fighters of [jaysh] tahrir al-sham in the city of ad dumayr"" -- whom the former accuses of being affiliated with isil -- if they leave the group.",whom the former accuses of being affiliated with isil,Jaysh al-Islam; martyr ahmad al-abdo forces,JAI; MAAAF,Islamic State,ISIL,,,Critique,,,,,,,,WJ,.
2016,Idlib,NA,no,no,no,no,no,no,no,no,JAA,.,.,.,other,"skip, confusion over whether/how any of this happened",TRR2016010781081886,2016-01-07,388,"on 7 january, twitter user ""mujahid al-sham"" claimed
 
 
 that ahrar al-sham islamic movement executed five individuals including
 
 
 three jund al-aqsa members who were linked with isil ""and participated
 
 
 in the latest assassination operations."" the user claimed that following
 
 
 the execution of its members, jund al-aqsa ""suspended its work in the
 
 
 executive body"" of the jaysh al-fath coalition. in a reply to this
 
 
 tweet, twitter user ""abu-khattab al-shami"" , self-described as
 
 
 a member of ahrar al-sham, claimed the following:
 
 
 
 
 
 ""1. ahrar al-sham did not execute anyone. it was [jaysh al-fath's]
 
 
 executive body which carried it out.""
 
 
 
 
 
 ""2. jund al-aqsa did not suspend its membership in the executive body,
 
 
 but rather the body's entire operation was suspended.""
 
 
 
 
 
 in response to al-shami's reply, mujahid al-sham tweeted an image of a
 
 
 statement bearing the logo and markings of jaysh al-fath's executive
 
 
 body -- but seemingly written by jund al-aqsa -- accusing ahrar al-sham
 
 
 of ""transgressions"" including taking prisoners out of jaysh al-fath's
 
 
 prison in idlib and executing them ""without informing the amir of the
 
 
 executive body."" the statement concludes: ""therefore, we, the jund
 
 
 al-aqsa faction, after all of the transgressions which took place by the
 
 
 ahrar al-sham faction, announce the suspension of the work of the
 
 
 executive body.""","jund al-aqsa ""suspended its work in the executive body"" of the jaysh al-fath coalition.",Jund al-Aqsa,JAA,Jaysh al-Fatah,JAF,,,Breakup,,,,,,,,WJ,.
,,,,,,,,,,,,,,,,,,2016-01-07,388.1,"on 7 january, twitter user ""mujahid al-sham"" claimed
 
 
 that ahrar al-sham islamic movement executed five individuals including
 
 
 three jund al-aqsa members who were linked with isil ""and participated
 
 
 in the latest assassination operations."" the user claimed that following
 
 
 the execution of its members, jund al-aqsa ""suspended its work in the
 
 
 executive body"" of the jaysh al-fath coalition. in a reply to this
 
 
 tweet, twitter user ""abu-khattab al-shami"" , self-described as
 
 
 a member of ahrar al-sham, claimed the following:
 
 
 
 
 
 ""1. ahrar al-sham did not execute anyone. it was [jaysh al-fath's]
 
 
 executive body which carried it out.""
 
 
 
 
 
 ""2. jund al-aqsa did not suspend its membership in the executive body,
 
 
 but rather the body's entire operation was suspended.""
 
 
 
 
 
 in response to al-shami's reply, mujahid al-sham tweeted an image of a
 
 
 statement bearing the logo and markings of jaysh al-fath's executive
 
 
 body -- but seemingly written by jund al-aqsa -- accusing ahrar al-sham
 
 
 of ""transgressions"" including taking prisoners out of jaysh al-fath's
 
 
 prison in idlib and executing them ""without informing the amir of the
 
 
 executive body."" the statement concludes: ""therefore, we, the jund
 
 
 al-aqsa faction, after all of the transgressions which took place by the
 
 
 ahrar al-sham faction, announce the suspension of the work of the
 
 
 executive body.""","ahrar al-sham did not execute anyone. it was [jaysh al-fath's] executive body which carried it out.""",Ahrar al-Sham Islamic Movement,ASIM,Jund al-Aqsa,JAA,,,Denial,,,,,,,,WJ,.
